{"name":"Mishtan City of the Dead","status":"missing","title":null,"pageId":null,"html":null,"error":{"code":"missingtitle","info":"The page you specified doesn't exist."},"source":{"wiki":"forgottenrealms.fandom.com","url":"https://forgottenrealms.fandom.com/api.php?action=parse&format=json&prop=text&page=Mishtan%20City%20of%20the%20Dead","fetchedAt":"2026-05-17T06:50:33Z"}}