{"name":"Phent","status":"ok","title":"Phent","pageId":25913,"html":"<div class=\"mw-content-ltr mw-parser-output\" dir=\"ltr\" lang=\"en\"><p class=\"mw-empty-elt\">\n</p><aside class=\"portable-infobox pi-background pi-border-color pi-theme-frwiki pi-layout-default type-location\" role=\"region\">\n\n<nav class=\"pi-navigation pi-item-spacing pi-secondary-font\"><a href=\"/wiki/Category:Maps_of_Phent\" title=\"Category:Maps of Phent\">Gallery</a></nav>\n<h2 class=\"pi-item pi-item-spacing pi-title pi-secondary-background\" data-source=\"name\">Phent</h2>\n<section class=\"pi-item pi-group pi-border-color\">\n<h2 class=\"pi-item pi-header pi-secondary-font pi-item-spacing pi-secondary-background\">Geography</h2>\n<div class=\"pi-item pi-data pi-item-spacing pi-border-color\" data-source=\"type\">\n<h3 class=\"pi-data-label pi-secondary-font\">Type</h3>\n<div class=\"pi-data-value pi-font\">City</div>\n</div>\n<div class=\"pi-item pi-data pi-item-spacing pi-border-color\" data-source=\"region\">\n<h3 class=\"pi-data-label pi-secondary-font\">Region</h3>\n<div class=\"pi-data-value pi-font\"><a href=\"/wiki/Thesk\" title=\"Thesk\">Thesk</a>, <a href=\"/wiki/Unapproachable_East\" title=\"Unapproachable East\">Unapproachable East</a></div>\n</div>\n</section>\n</aside>\n<p class=\"mw-empty-elt\"></p><p><b>Phent</b> was a fortress city in <a href=\"/wiki/Thesk\" title=\"Thesk\">Thesk</a> along the <a href=\"/wiki/Golden_Way\" title=\"Golden Way\">Golden Way</a>.<sup class=\"reference\" id=\"cite_ref-S.ToD-p11_1-0\"><a href=\"#cite_note-S.ToD-p11-1\"><span class=\"cite-bracket\">[</span>1<span class=\"cite-bracket\">]</span></a></sup>\n</p>\n<h2><span class=\"mw-headline\" id=\"Appendix\">Appendix</span><span class=\"mw-editsection\"><span class=\"mw-editsection-bracket\">[</span><a aria-label=\"Edit section: Appendix\" class=\"mw-editsection-visualeditor\" data-action=\"edit-section\" data-tracking-label=\"edit-section-anon\" href=\"https://forgottenrealms.fandom.com/wiki/Phent?veaction=edit&amp;section=1\" title=\"Edit section: Appendix\"></a><span class=\"mw-editsection-bracket\">]</span></span></h2>\n<table class=\"metadata plainlinks stub\"><tbody><tr>\n<td><i>This  article  is a <a class=\"extiw\" href=\"https://en.wikipedia.org/wiki/Wikipedia:stub\" title=\"wikipedia:Wikipedia:stub\">stub</a>.  You can help the Forgotten Realms Wiki by <a class=\"text\" href=\"https://forgottenrealms.fandom.com/wiki/Phent?action=edit\" rel=\"noreferrer noopener\" target=\"_blank\">expanding it</a>.</i></td>\n</tr></tbody></table>\n<h3><span class=\"mw-headline\" id=\"References\">References</span><span class=\"mw-editsection\"><span class=\"mw-editsection-bracket\">[</span><a aria-label=\"Edit section: References\" class=\"mw-editsection-visualeditor\" data-action=\"edit-section\" data-tracking-label=\"edit-section-anon\" href=\"https://forgottenrealms.fandom.com/wiki/Phent?veaction=edit&amp;section=2\" title=\"Edit section: References\"></a><span class=\"mw-editsection-bracket\">]</span></span></h3>\n<div class=\"reflist\" style=\"\">\n<div class=\"mw-references-wrap\"><ol class=\"references\">\n<li id=\"cite_note-S.ToD-p11-1\"><span class=\"mw-cite-backlink\"><a href=\"#cite_ref-S.ToD-p11_1-0\">↑</a></span> <span class=\"reference-text\"><a href=\"/wiki/Anthony_Pryor\" title=\"Anthony Pryor\">Anthony Pryor</a> (June 1995). “Throne of Deceit”. In <a href=\"/wiki/Michele_Carter\" title=\"Michele Carter\">Michele Carter</a>, <a href=\"/wiki/Doug_Stewart\" title=\"Doug Stewart\">Doug Stewart</a> eds. <i><a href=\"/wiki/Spellbound\" title=\"Spellbound\">Spellbound</a></i> (<a href=\"/wiki/TSR,_Inc.\" title=\"TSR, Inc.\">TSR, Inc.</a>), p. 11. ISBN <a href=\"/wiki/Special:BookSources/978-0786901395\" title=\"Special:BookSources/978-0786901395\">978-0786901395</a>.</span>\n</li>\n</ol></div>\n</div>\n<!-- \nNewPP limit report\nCached time: 20260516053011\nCache expiry: 1209600\nReduced expiry: false\nComplications: []\nCPU time usage: 0.050 seconds\nReal time usage: 0.067 seconds\nPreprocessor visited node count: 727/1000000\nPost‐expand include size: 2254/2097152 bytes\nTemplate argument size: 791/2097152 bytes\nHighest expansion depth: 14/100\nExpensive parser function count: 1/100\nUnstrip recursion depth: 0/20\nUnstrip post‐expand size: 740/5000000 bytes\nExtLoops count: 0/200\n-->\n<!--\nTransclusion expansion time report (%,ms,calls,template)\n100.00%   52.170      1 -total\n 70.46%   36.758      1 Template:Location\n 17.39%    9.071      1 Template:Refs\n 11.34%    5.914      1 Template:Cite_book/Spellbound/Throne_of_Deceit\n  9.07%    4.730      1 Template:Cite_book\n  6.62%    3.456      1 Template:Cite_publication\n  5.91%    3.081      1 Template:Stub\n  3.47%    1.810      1 Template:Asbox\n  2.30%    1.201      2 Template:FormatAlias\n-->\n<!-- Saved in parser cache with key 1.43.8_prod_forgottenrealms:pcache:idhash:25913-0!sseVary=RegularPage!FandomDesktop!LegacyGalleries and timestamp 20260516053011 and revision id 974629. Rendering was triggered because: api-parse\n -->\n</div>","error":null,"source":{"wiki":"forgottenrealms.fandom.com","url":"https://forgottenrealms.fandom.com/api.php?action=parse&format=json&prop=text&page=Phent","fetchedAt":"2026-05-17T07:01:49Z"}}