{"name":"The Mucklestones","status":"missing","title":null,"pageId":null,"html":null,"error":{"code":"missingtitle","info":"The page you specified doesn't exist."},"source":{"wiki":"forgottenrealms.fandom.com","url":"https://forgottenrealms.fandom.com/api.php?action=parse&format=json&prop=text&page=The%20Mucklestones","fetchedAt":"2026-05-17T06:50:40Z"}}