{"name":"The Watchwall","status":"ok","title":"Watchwall","pageId":26430,"html":"<div class=\"mw-content-ltr mw-parser-output\" lang=\"en\" dir=\"ltr\"><p class=\"mw-empty-elt\">\n</p><aside role=\"region\" class=\"portable-infobox pi-background pi-border-color pi-theme-frwiki pi-layout-default type-location\">\n\n\n<h2 class=\"pi-item pi-item-spacing pi-title pi-secondary-background\" data-source=\"name\">Watchwall</h2>\n<section class=\"pi-item pi-group pi-border-color\">\n\t<h2 class=\"pi-item pi-header pi-secondary-font pi-item-spacing pi-secondary-background\">Geography</h2>\n\n<div class=\"pi-item pi-data pi-item-spacing pi-border-color\" data-source=\"type\">\n\t\n\t\t<h3 class=\"pi-data-label pi-secondary-font\">Type</h3>\n\t\n\t<div class=\"pi-data-value pi-font\">Defensive wall</div>\n</div>\n\n</section>\n</aside>\n\n<p class=\"mw-empty-elt\"></p><p>The <b>Watchwall</b> was a massive, magically engineered length of stone wall, stretching from the fortress city of <a href=\"/wiki/Glarondar\" title=\"Glarondar\">Glarondar</a> to the slopes of <a href=\"/wiki/Umbergoth\" title=\"Umbergoth\">Umbergoth</a>, thus extending the defensive barrier of the <a href=\"/wiki/Dragonjaw_Mountains\" title=\"Dragonjaw Mountains\">Dragonjaw Mountains</a> another fifteen miles, up to a rock-like fortification containing one-third of <a href=\"/wiki/Aglarond\" title=\"Aglarond\">Aglarond</a>'s armed forces.<sup id=\"cite_ref-FRCG|89_1-0\" class=\"reference\"><a href=\"#cite_note-FRCG|89-1\"><span class=\"cite-bracket\">[</span>1<span class=\"cite-bracket\">]</span></a></sup> It was constructed by the <a href=\"/wiki/Galeb_duhr\" title=\"Galeb duhr\">galeb duhr</a> living in <a href=\"/wiki/Tannath\" title=\"Tannath\">Tannath</a> and Undergoth in <a href=\"/wiki/1085_DR\" title=\"1085 DR\">1085 DR</a>.<sup id=\"cite_ref-TGHotR-p118_2-0\" class=\"reference\"><a href=\"#cite_note-TGHotR-p118-2\"><span class=\"cite-bracket\">[</span>2<span class=\"cite-bracket\">]</span></a></sup>\n</p>\n<h2><span class=\"mw-headline\" id=\"Appendix\">Appendix</span><span class=\"mw-editsection\"><span class=\"mw-editsection-bracket\">[</span><a title=\"Edit section: Appendix\" class=\"mw-editsection-visualeditor\" data-tracking-label=\"edit-section-anon\" data-action=\"edit-section\" href=\"https://forgottenrealms.fandom.com/wiki/Watchwall?veaction=edit&section=1\" aria-label=\"Edit section: Appendix\"></a><span class=\"mw-editsection-bracket\">]</span></span></h2>\n<table class=\"metadata plainlinks stub\"><tbody><tr>\n<td><span typeof=\"mw:File\"></span></td>\n<td><i>This Realmslore article about a geographical location is a <a href=\"https://en.wikipedia.org/wiki/Wikipedia:stub\" class=\"extiw\" title=\"wikipedia:Wikipedia:stub\">stub</a>.  You can help the Forgotten Realms Wiki by <a target=\"_blank\" rel=\"noreferrer noopener\" class=\"text\" href=\"https://forgottenrealms.fandom.com/wiki/Watchwall?action=edit\">expanding it</a>.</i></td>\n</tr></tbody></table>\n<h3><span class=\"mw-headline\" id=\"References\">References</span><span class=\"mw-editsection\"><span class=\"mw-editsection-bracket\">[</span><a title=\"Edit section: References\" class=\"mw-editsection-visualeditor\" data-tracking-label=\"edit-section-anon\" data-action=\"edit-section\" href=\"https://forgottenrealms.fandom.com/wiki/Watchwall?veaction=edit&section=2\" aria-label=\"Edit section: References\"></a><span class=\"mw-editsection-bracket\">]</span></span></h3>\n<div class=\"reflist\">\n<div class=\"mw-references-wrap\"><ol class=\"references\">\n<li id=\"cite_note-FRCG|89-1\"><span class=\"mw-cite-backlink\"><a href=\"#cite_ref-FRCG|89_1-0\">↑</a></span> <span class=\"reference-text\"><a href=\"/wiki/Bruce_R._Cordell\" title=\"Bruce R. Cordell\">Bruce R. Cordell</a>, <a href=\"/wiki/Ed_Greenwood\" title=\"Ed Greenwood\">Ed Greenwood</a>, <a href=\"/wiki/Chris_Sims\" title=\"Chris Sims\">Chris Sims</a>&#160;(August 2008). <i><a href=\"/wiki/Forgotten_Realms_Campaign_Guide\" title=\"Forgotten Realms Campaign Guide\">Forgotten Realms Campaign Guide</a></i>. Edited by <a href=\"/wiki/Jennifer_Clarke_Wilkes\" title=\"Jennifer Clarke Wilkes\">Jennifer Clarke Wilkes</a>, <i>et al</i>. (<a href=\"/wiki/Wizards_of_the_Coast\" title=\"Wizards of the Coast\">Wizards of the Coast</a>), p. 89. ISBN&#160;<a href=\"/wiki/Special:BookSources/978-0-7869-4924-3\" title=\"Special:BookSources/978-0-7869-4924-3\">978-0-7869-4924-3</a>.</span>\n</li>\n<li id=\"cite_note-TGHotR-p118-2\"><span class=\"mw-cite-backlink\"><a href=\"#cite_ref-TGHotR-p118_2-0\">↑</a></span> <span class=\"reference-text\"><a href=\"/wiki/Brian_R._James\" title=\"Brian R. James\">Brian R. James</a>, <a href=\"/wiki/Ed_Greenwood\" title=\"Ed Greenwood\">Ed Greenwood</a>&#160;(September 2007). <i><a href=\"/wiki/The_Grand_History_of_the_Realms\" title=\"The Grand History of the Realms\">The Grand History of the Realms</a></i>. Edited by <a href=\"/wiki/Kim_Mohan\" title=\"Kim Mohan\">Kim Mohan</a>, <a href=\"/wiki/Penny_Williams\" title=\"Penny Williams\">Penny Williams</a>. (<a href=\"/wiki/Wizards_of_the_Coast\" title=\"Wizards of the Coast\">Wizards of the Coast</a>), p. 118. ISBN&#160;<a href=\"/wiki/Special:BookSources/978-0-7869-4731-7\" title=\"Special:BookSources/978-0-7869-4731-7\">978-0-7869-4731-7</a>.</span>\n</li>\n</ol></div>\n</div>\n<!-- \nNewPP limit report\nCached time: 20261026153734\nCache expiry: 1209600\nReduced expiry: false\nComplications: []\nCPU time usage: 0.058 seconds\nReal time usage: 0.074 seconds\nPreprocessor visited node count: 781/1000000\nPost‐expand include size: 4407/2097152 bytes\nTemplate argument size: 2010/2097152 bytes\nHighest expansion depth: 14/100\nExpensive parser function count: 0/100\nUnstrip recursion depth: 0/20\nUnstrip post‐expand size: 1419/5000000 bytes\nExtLoops count: 0/200\n-->\n<!--\nTransclusion expansion time report (%,ms,calls,template)\n100.00%   51.446      1 -total\n 58.30%   29.995      1 Template:Location\n 28.32%   14.569      1 Template:Refs\n 13.45%    6.920      1 Template:Cite_book/Forgotten_Realms_Campaign_Guide\n 13.17%    6.775      2 Template:Cite_book\n  9.95%    5.118      2 Template:Cite_publication\n  8.14%    4.187      1 Template:Stub-geo\n  4.91%    2.526      1 Template:Cite_book/The_Grand_History_of_the_Realms\n  4.13%    2.126      1 Template:Asbox\n  3.37%    1.734      4 Template:FormatAlias\n-->\n\n<!-- Saved in parser cache with key 1.43.9_prod_forgottenrealms:pcache:idhash:26430-0!sseVary=RegularPage!FandomDesktop!LegacyGalleries and timestamp 20261026153734 and revision id 1040004. Rendering was triggered because: page-view\n -->\n</div>","error":null,"source":{"wiki":"forgottenrealms.fandom.com","url":"https://forgottenrealms.fandom.com/api.php?action=parse&format=json&prop=text%7Crevid&page=Watchwall","fetchedAt":"2026-10-30T18:00:59.609Z","revisionId":1040004}}