{"name":"Sundrah","status":"ok","title":"Sundrah","pageId":19883,"html":"<div class=\"mw-content-ltr mw-parser-output\" dir=\"ltr\" lang=\"en\"><p class=\"mw-empty-elt\">\n</p><aside class=\"portable-infobox pi-background pi-border-color pi-theme-frwiki pi-layout-default type-location\" role=\"region\"><nav class=\"pi-navigation pi-item-spacing pi-secondary-font\"><a href=\"/wiki/Category:Maps_of_Sundrah\" title=\"Category:Maps of Sundrah\">Gallery</a></nav>\n<h2 class=\"pi-item pi-item-spacing pi-title pi-secondary-background\" data-source=\"name\">Sundrah</h2>\n<section class=\"pi-item pi-group pi-border-color\">\n<h2 class=\"pi-item pi-header pi-secondary-font pi-item-spacing pi-secondary-background\">Geography</h2>\n<div class=\"pi-item pi-data pi-item-spacing pi-border-color\" data-source=\"type\">\n<h3 class=\"pi-data-label pi-secondary-font\">Type</h3>\n<div class=\"pi-data-value pi-font\">City</div>\n</div>\n<div class=\"pi-item pi-data pi-item-spacing pi-border-color\" data-source=\"region\">\n<h3 class=\"pi-data-label pi-secondary-font\">Region</h3>\n<div class=\"pi-data-value pi-font\"><a href=\"/wiki/Lantan\" title=\"Lantan\">Lantan</a></div>\n</div>\n</section>\n</aside>\n<p class=\"mw-empty-elt\"></p><p><b>Sundrah</b> was a city located in the northern part of the island of <a href=\"/wiki/Lantan\" title=\"Lantan\">Lantan</a> in the <a href=\"/wiki/Trackless_Sea\" title=\"Trackless Sea\">Trackless Sea</a>.<sup class=\"reference\" id=\"cite_ref-1\"><a href=\"#cite_note-1\"><span class=\"cite-bracket\">[</span>1<span class=\"cite-bracket\">]</span></a></sup>\n</p>\n<h2><span class=\"mw-headline\" id=\"References\">References</span><span class=\"mw-editsection\"><span class=\"mw-editsection-bracket\">[</span><a aria-label=\"Edit section: References\" class=\"mw-editsection-visualeditor\" data-action=\"edit-section\" data-tracking-label=\"edit-section-anon\" href=\"https://forgottenrealms.fandom.com/wiki/Sundrah?veaction=edit&amp;section=1\" title=\"Edit section: References\"></a><span class=\"mw-editsection-bracket\">]</span></span></h2>\n<div class=\"reflist\" style=\"\">\n<div class=\"mw-references-wrap\"><ol class=\"references\">\n<li id=\"cite_note-1\"><span class=\"mw-cite-backlink\"><a href=\"#cite_ref-1\">↑</a></span> <span class=\"reference-text\"><a href=\"/wiki/Karen_Wynn_Fonstad\" title=\"Karen Wynn Fonstad\">Karen Wynn Fonstad</a> (August 1990). <i><a href=\"/wiki/The_Forgotten_Realms_Atlas\" title=\"The Forgotten Realms Atlas\">The Forgotten Realms Atlas</a></i>. (<a class=\"mw-redirect\" href=\"/wiki/TSR,_Inc\" title=\"TSR, Inc\">TSR, Inc</a>), p. 8. ISBN <a href=\"/wiki/Special:BookSources/978-0880388573\" title=\"Special:BookSources/978-0880388573\">978-0880388573</a>.</span>\n</li>\n</ol></div>\n</div>\n<table class=\"metadata plainlinks stub\"><tbody><tr>\n<td><span typeof=\"mw:File\"></span></td>\n<td><i>This Realmslore article about a geographical location is a <a class=\"extiw\" href=\"https://en.wikipedia.org/wiki/Wikipedia:stub\" title=\"wikipedia:Wikipedia:stub\">stub</a>.  You can help the Forgotten Realms Wiki by <a class=\"text\" href=\"https://forgottenrealms.fandom.com/wiki/Sundrah?action=edit\" rel=\"noreferrer noopener\" target=\"_blank\">expanding it</a>.</i></td>\n</tr></tbody></table>\n<!-- \nNewPP limit report\nCached time: 20260514054926\nCache expiry: 2592000\nReduced expiry: false\nComplications: []\nCPU time usage: 0.050 seconds\nReal time usage: 0.066 seconds\nPreprocessor visited node count: 568/1000000\nPost‐expand include size: 2211/2097152 bytes\nTemplate argument size: 587/2097152 bytes\nHighest expansion depth: 12/100\nExpensive parser function count: 1/100\nUnstrip recursion depth: 0/20\nUnstrip post‐expand size: 612/5000000 bytes\nExtLoops count: 0/200\n-->\n<!--\nTransclusion expansion time report (%,ms,calls,template)\n100.00%   51.921      1 -total\n 64.87%   33.679      1 Template:Location\n 25.15%   13.058      1 Template:Refs\n 17.16%    8.910      1 Template:Cite_book/The_Forgotten_Realms_Atlas\n 13.88%    7.208      1 Template:Cite_book\n  9.77%    5.072      1 Template:Cite_publication\n  6.70%    3.479      1 Template:Stub-geo\n  4.02%    2.085      1 Template:Asbox\n  3.35%    1.739      1 Template:FormatAlias\n-->\n<!-- Saved in parser cache with key 1.43.8_prod_forgottenrealms:pcache:idhash:19883-0!sseVary=RegularPage!FandomDesktop!LegacyGalleries and timestamp 20260514054926 and revision id 973010. Rendering was triggered because: page-view\n -->\n</div>","error":null,"source":{"wiki":"forgottenrealms.fandom.com","url":"https://forgottenrealms.fandom.com/api.php?action=parse&format=json&prop=text&page=Sundrah","fetchedAt":"2026-05-17T07:01:51Z"}}