{"name":"Amrutlar","status":"ok","title":"Amrutlar","pageId":184955,"html":"<div class=\"mw-content-ltr mw-parser-output\" dir=\"ltr\" lang=\"en\"><div class=\"redirectMsg\"><p>Redirect to:</p><ul class=\"redirectText\"><li><a href=\"/wiki/Amruthar\" title=\"Amruthar\">Amruthar</a></li></ul></div>\n<!-- \nNewPP limit report\nCached time: 20260517065022\nCache expiry: 1209600\nReduced expiry: false\nComplications: []\nCPU time usage: 0.001 seconds\nReal time usage: 0.001 seconds\nPreprocessor visited node count: 0/1000000\nPost‐expand include size: 0/2097152 bytes\nTemplate argument size: 0/2097152 bytes\nHighest expansion depth: 0/100\nExpensive parser function count: 0/100\nUnstrip recursion depth: 0/20\nUnstrip post‐expand size: 0/5000000 bytes\nExtLoops count: 0/200\n-->\n<!--\nTransclusion expansion time report (%,ms,calls,template)\n100.00%    0.000      1 -total\n-->\n<!-- Saved in parser cache with key 1.43.8_prod_forgottenrealms:pcache:idhash:184955-0!sseVary=RegularPage!FandomDesktop!LegacyGalleries and timestamp 20260517065022 and revision id 1064395. Rendering was triggered because: api-parse\n -->\n</div>","error":null,"source":{"wiki":"forgottenrealms.fandom.com","url":"https://forgottenrealms.fandom.com/api.php?action=parse&format=json&prop=text&page=Amrutlar","fetchedAt":"2026-05-17T07:01:45Z"}}